,cosine_similarity,dissimilarity,base_rate,base_rate_diff,FFR,ko-us_gap,governor,president,tr1,tr2,raw_statement,stem_statement
1999-01-07,,,,,4.75,,전철환,김대중,,,"국내경제는 지난 11월중 수출증대에 힘입어 산업생산이 소폭 증가로 반전되고 소비 및 투자 등 내수도 감소세가 둔화되는 등 경기가 다소 호전되는 움직임을 나타내었음
외환시장에서는 경상수지 흑자가 지속되고 외국인투자자금이 꾸준히 유입됨으로써 외환공급 우위기조가 강화되어 원화환율이 큰 폭으로 하락하고 가용외환보유액이 98년 12월말 현재 500억달러에 육박하였음
금융시장에서는 물가 및 환율이 안정된 가운데 공개시장조작금리 인하와 향후 경기부양을 위한 확장적 경제정책 운용기대로 장기시장금리가 큰 폭으로 하락하고 은행대출금리도 꾸준히 낮아지면서
상업어음할인 등 중소기업대출이 다소 회복되고 CP 및 회사채 발행에 있어 발행대상기업이 확대되고 신용등급별 금리격차가 꾸준히 축소되는 등 신용경색 현상이 완화되는 모습을 보이고 있음
한편 강한 금리하락 기대와 낙관적 경제전망 등의 영향으로 금융저축 자금의 일부가 주식시장으로 이동하면서 주가가 급등하는 등 자산가격이 상승하는 움직임을 보였음
앞으로도 외환공급우위로 환율절상 압력을 받고 이에 따라 금리하락 기대가 이어지는 한편 경기회복과정에서 풍부한 유동성과 저금리를 바탕으로 자산가격이 불안한 움직임을 보일 가능성이 있음
이러한 점을 감안할 때 적절한 외환수급조절을 통해 환율절상 압력이 과도히 커지지 않도록 하여 통화정책이 국내경제여건을 고려하여 탄력적으로 이루어질 수 있도록 노력하는 한편
금융자금 이동 및 자산시장 동향을 주의깊게 관찰하면서 그간의 금융완화정책이 실물경제에 파급되는 효과를 면밀히 분석할 필요가 있음
이에 따라 1월중 공개시장조작은 외환시장 및 금융시장 여건을 보아가며 콜금리를 약간 하향조정된 수준에서 안정되도록 운영하는 한편 본원통화를 은행의 대출자금수요에 맞추어 공급하는 방향으로 운영함","['국내', '경제', '지난', '수출', '증대', '힘', '입다', '산업', '생산', '폭', '증가', '반전', '되다', '소비', '및', '투자', '등', '내', '수도', '감소', '세', '둔화', '되다', '등', '경기', '다소', '호전', '되다', '움직임', '나타내다', '외환시장', '경상수지', '흑자', '지속', '되다', '외국인투자', '자금', '꾸준하다', '유입', '되다', '외환', '공급', '우위', '조가', '강화', '되어다', '원화', '환율', '크다', '폭', '하락', '가용', '외환', '보유', '액', '현재', '육박', '하다', '금융시장', '물가', '및', '환율', '안정', '되다', '가운데', '공개시장', '조작', '금리', '인하', '향후', '기부', '위', '확장', '경제정책', '운', '용기', '장기시', '금리', '크다', '폭', '하락', '은행', '대출', '금리', '꾸준하다', '낮아지다', '상업', '어음', '할인', '등', '중소기업', '대출', '다소', '회복', '되다', '및', '회사채', '발행', '있다', '발행', '대상', '기업', '확대', '되다', '신용등급', '별', '금리', '격차', '꾸준하다', '축소', '되다', '등', '신용', '경색', '현상', '완화', '되다', '모습', '보이', '있다', '한편', '강하다', '금리', '하락', '기대', '낙관', '경제', '전망', '등', '영향', '금융', '저축', '자금', '일부', '주식시장', '이동', '하다', '주가', '급등', '하다', '등', '자산', '가격', '상승', '하다', '움직임', '보이다', '앞', '외환', '공급', '우위', '환율', '절상', '압력', '받다', '이', '따르다', '금리', '하락', '기대', '이어지다', '한편', '회복', '과정', '풍부하다', '유동성', '저', '금리', '바탕', '자산', '가격', '불안하다', '움직임', '보이다', '가능성', '있다', '이러하다', '점', '감안', '하다', '때', '적절하다', '외환', '수급', '조절', '통해', '환율', '절상', '압력', '과도', '히', '커지다', '않다', '하다', '통화정책', '국내', '여건', '고려', '하다', '탄력', '이루어지다', '수', '있다', '노력', '하다', '한편', '금융', '자금', '이동', '및', '자산', '시장', '동향', '주의', '깊다', '관찰', '하다', '그간', '금융', '완화', '정책', '실물', '경제', '파급', '되다', '효과', '면밀하다', '분석', '하다', '필요', '있다', '이', '따르다', '공개시장', '조작', '외환시장', '및', '금융시장', '여건', '보다', '콜', '금리', '약간', '하향', '조정', '되다', '수준', '안정', '되다', '운영', '하다', '한편', '본원통화', '은행', '대출', '자금', '수요', '맞추다', '공급', '하다', '방향', '운영', '함']"
1999-02-04,0.7279401698395885,0.27205983016041146,,,4.75,,전철환,김대중,,,"국내경제는 지난 12월중 수출증가 및 내수 감소세 둔화에 힘입어 산업생산이 연 2개월째 증가하고 경기동행종합지수가 4개월 연속 상승하는 등 실물경기가 개선추세를 보였음
물가는 1월에도 금리 및 환율 하락, 임금안정 등으로 전월대비 하락하는 등 안정세를 나타냈으나
무역수지 흑자폭은 수입이 빠른 속도로 늘어남에 따라 크게 축소되었음
외환시장에서는 1월중 국가신용등급이 투자적격으로 상향조정된 가운데 외국인 투자자금 유입 증대로 공급우위의 수급구조가 이어지면서 환율절상압력이 지속되어 원화환율이 전월말보다 하락하였음
금융시장에서는 1월중 단기시장금리가 꾸준한 하락세를 보였으나 월초에 크게 떨어졌던 장기시장금리는 금년도 경제성장 전망의 상향조정과 국제금융시장 불안 등에 따른 경계심리로 반등하였음
한편 은행대출금리가 하락하고 있는 가운데 직접금융시장에서 CP 및 회사채 발행기업의 범위가 확대되고
외화차입도 국가신용등급 상향조정으로 보다 원활하게 이루어질 것으로 기대되는 등 기업의 대내외 자금조달 여건은  크게 개선되고 있음
그러나 금융자금 흐름면에서는 시중자금이 투신사의 단기상품으로 대거 이동하고 금융기관간 상호거래가 크게 늘어나는 등 자금이 단기유동화되는 모습이 나타났음
이러한 점들을 감안하여 2월중 통화정책은 다음과 같은 방향으로 운영함
M3가 연간 목표증가율(13∼14%)을 유지하는 범위내에서 설 등 계절적 자금수요를 감안하여 본원통화를 공급하되 재정의 조기집행 등으로 인한 추가적인 유동성 증가는 공개시장조작을 통해 적절히 조절함
콜금리는 금융시장에서의 자금흐름, 장단기시장금리의 움직임 등을 면밀히 관찰하면서 외환수급상황을 감안하여 하향안정화 기조를 견지함","['국내', '경제', '지난', '수출', '증가', '및', '내', '수', '감소', '세', '둔화', '힘', '입다', '산업', '생산', '연', '개월', '증가', '동행', '종합', '지수', '개월', '연속', '상승', '하다', '등', '실물', '경기', '개선', '추세', '보이다', '물가', '금리', '및', '환율', '하락', '임금', '안정', '등', '전월', '대비', '하락', '하다', '등', '안정', '세', '나타내다', '무역수지', '흑', '자폭', '수입', '빠르다', '속도', '늘어나다', '따르다', '크게', '축소', '되어다', '외환시장', '국가신용등급', '투자', '격', '상향', '조정', '되다', '가운데', '외국인', '투자', '자금', '유입', '증대', '공급', '우위', '급구', '이어지다', '환율', '절상', '압력', '지속', '되어다', '원화', '환율', '월말', '하락', '하다', '금융시장', '시장', '금리', '꾸준하다', '하락', '세', '보이다', '월초', '크게', '떨어지다', '장기시', '금리', '금년', '경제성장', '전망', '상향', '조정', '국제', '금융시장', '불안', '등', '따르다', '경계', '심리', '반등', '하다', '한편', '은행', '대출', '금리', '하락', '있다', '가운데', '직접', '금융시장', '및', '회사채', '발행', '기업', '범위', '확대', '되다', '외화', '차입', '국가신용등급', '상향', '조정', '보다', '원활하다', '이루어지다', '것', '기대', '되다', '등', '기업', '내외', '자금', '조달', '여건', '크게', '개선', '되다', '있다', '그러나', '금융', '자금', '흐르다', '시중', '자금', '투신', '사의', '상품', '대거', '이동', '금융기관', '상호', '거래', '크게', '늘어나다', '등', '자금', '유동화', '되다', '모습', '나타나다', '이러하다', '점', '감안', '하다', '통화정책', '다음', '같다', '방향', '운영', '함', '가다', '연간', '목표', '증가', '율', '유지', '하다', '범위', '내', '설', '등', '계절', '자금', '수요', '감안', '하다', '본원통화', '공급', '되다', '재정', '조기', '집행', '등', '인하다', '추가', '유동성', '증가', '공개시장', '조작', '통해', '적절하다', '조절', '함', '콜', '금리', '금융시장', '자금', '흐름', '장단', '시장', '금리', '움직임', '등', '면밀하다', '관찰', '하다', '외환', '수급', '상황', '감안', '하다', '하향', '안정화', '기조', '견지함']"
1999-03-04,0.7333033791496064,0.2666966208503936,,,4.75,,전철환,김대중,,,"국내경제는 1월중 생산증가세가 크게 확대되고 소비 투자 등 내수도 그간의 감소세에서 벗어나 소폭 증가하는 등 꾸준한 회복세를 보이고 있으며 경기선행지표 움직임으로 볼 때도 당분간 이러한 회복세를 지속할 것으로 전망됨
다만 엔화 약세 등으로 인한 수출부진 가능성, 기업 구조조정과정에서의 노사갈등 우려 등 대내외 불안요인이 잠재해 있음
물가는 2월중 설 요인으로 농수축산물 가격이 일시적으로 크게 올라 소비자물가가 상승하였으나 생산자물가가 하락세를 지속하는 등 전반적으로 안정세를 유지하고 있음
외환수급면에서는 2월중 무역수지 흑자 등으로 공급우위기조가 이어지는 가운데 국가신용등급의 투자적격 회복 등으로 해외차입여건이 크게 호전되었으나 엔화 약세의 영향으로 원/달러 환율이 1,200원대로 상승하였음
앞으로도 외환시장은 수급면에서 공급우위가 예상되나 환율은 엔화 환율의 변동에 큰 영향을 받을 것으로 예상됨
금융시장에서는 외환시장에서 공급우위가 지속되는 가운데 2월중 공개시장조작금리 인하로 콜금리가 비교적 큰 폭으로 하락하였음에도 불구하고 장기시장금리는 하반기중 경기상승 기대 등으로 2월 중순까지 상승압력을 받아 장단기금리격차가 확대되었음
그러나 2월 하순이후 장기시장금리가 하락세로 돌아서는 한편 은행대출금리도 계속 하락하여 전반적으로 금리가 낮은 수준을 유지하였음
전반적인 금리하락과 더불어 중소기업대출이 크게 늘어나 공급측면에서의 신용경색은 상당부분 해소된 것으로 보임
다만 대기업의 부채축소 노력과 자금수요 둔화 등으로 전체 은행대출 및 회사채 발행은 크게 늘지 않아 총유동성(M3) 수준은 연간 증가율목표 범위의 하한을 다소 밑도는 것으로 추정되며 이러한 추세는 당분간 지속될 것으로 예상됨
이와 같은 점들을 종합적으로 감안하여 3월중 통화정책은 본원통화를 은행의 지준수요에 맞추어 신축적으로 공급하는 가운데 콜금리는 장단기 시장금리의 안정을 뒷받침하는 방향으로 운영함","['국내', '경제', '생산', '증가', '세', '크게', '확대', '되다', '소비', '투자', '등', '내', '수도', '그간', '감소', '세', '벗어나다', '폭', '증가', '하다', '등', '꾸준하다', '회복', '세', '보이', '있다', '경기', '선행', '지표', '움직임', '볼', '때', '당분간', '이러하다', '회복', '세', '지속', '하다', '것', '전망', '되다', '다만', '엔화', '약세', '등', '인하다', '수출', '부진', '가능성', '기업', '구조조정', '과정', '노사', '갈등', '우려', '등', '내외', '불안', '요인', '잠재', '하다', '있다', '물가', '설', '요인', '농', '축산물', '가격', '일시', '크게', '오르다', '소비자', '물가', '상승', '하다', '생산자', '물가', '하락', '세', '지속', '하다', '등', '전반', '안정', '세', '유지', '있다', '외환', '수급', '무역수지', '흑자', '등', '급우', '위기', '이어지다', '가운데', '국가신용등급', '투자', '격', '회복', '등', '해외', '차입', '여건', '크게', '호전', '되어다', '엔화', '약세', '영향', '원', '달러', '환율', '상승', '하다', '앞', '외환시장', '수급', '면', '공급', '우위', '예상', '되다', '환율', '엔화', '환율', '변동', '크다', '영향', '받다', '것', '예상', '되다', '금융시장', '외환시장', '공급', '우위', '지속', '되다', '가운데', '공개시장', '조작', '금리', '인하', '콜', '금리', '비교', '크다', '폭', '하락', '하다', '불구', '장기시', '금리', '하반기', '경기', '상승', '기대', '등', '중순', '상승', '압력', '받다', '장단', '금리', '격차', '확대', '되어다', '그러나', '하순', '이후', '장기시', '금리', '하락', '세로', '돌아서다', '한편', '은행', '대출', '금리', '계속', '하락', '하다', '전반', '금리', '낮다', '수준', '유지', '하다', '전반', '금리', '하락', '더불다', '중소기업', '대출', '크게', '늘어나다', '공급', '측면', '신용', '경색', '상당', '부분', '해소', '되다', '것', '보임', '다만', '대기업', '부채', '축소', '노력', '자금', '수요', '둔화', '등', '전체', '은행', '대출', '및', '회사채', '발행', '크게', '늘', '않다', '유동성', '수준', '연간', '증가', '율', '목표', '범위', '하다', '다소', '밑도', '것', '추정', '되다', '이러하다', '추세', '당분간', '지속', '되다', '것', '예상', '되다', '이', '같다', '점', '종합', '감안', '하다', '통화정책', '본원통화', '은행', '준', '수요', '맞추다', '신축', '공급', '하다', '가운데', '콜', '금리', '장', '단기', '시장', '금리', '안정', '뒷받침', '하다', '방향', '운영', '함']"
1999-04-08,0.8112130143652936,0.18878698563470642,,,4.75,,전철환,김대중,,,"국내경제는 2월중 설연휴에도 불구하고 생산 증가세가 이어진 가운데 소비가 크게 확대되는 등 뚜렷한 회복세를 보이고 있으며 경기지수 등 선행지표의 움직임을 볼 때 이러한 경기회복세가 지속될 것으로 보임
그러나 고용사정의 악화, 국제유가의 상승, 투자심리 회복의 미흡 등 경기회복에 대한 대내외 불안요인이 잠재하고 있음
물가는 3월중 소비자물가가 전월에 비해 소폭 상승하였으나 생산자물가가 하락세를 지속하는 등 안정세를 유지하였음
앞으로도 물가는 국제유가 상승 등 비용측면에서의 불안요인이 있으나 수요면에서의 상승압력이 크지 않아 대체로 안정세를 유지할 것으로 전망됨
외환수급면에서는 3월중 경상수지흑자가 지속된 데다 국내기업의 해외차입 및 증권발행 확대로 장기자본거래 흑자가 늘어난 데 힘입어 공급우위규모가 1, 2월에 비해 크게 확대되었으며 이러한 추세는 앞으로도 이어질 것으로 전망됨
금융시장에서는 장기시장금리가 하락세를 보이고 은행 여수신금리 등도 계속 하락하고 있는 가운데
은행의 대출확대 노력 등으로 중소기업 대출이 꾸준히 늘어나고 있어 공급측 요인에 의한 신용경색은 상당부분 해소된 것으로 보임
다만 대기업대출과 회사채 발행은 크게 늘어나지 않았는데 이는 주로 기업의 자금수요 둔화 및 회사채보유한도제 등에 기인하는 것으로 판단됨
이에 반해 주식시장을 통한 기업자금조달은 매우 활발하였는데 이는 기업의 재무구조개선 노력과 더불어 주식시장이 엔화환율의 안정, 미국 등 해외증시의 호조, 국내금리의 하락 등 증시주변환경 개선으로 활황을 보인 데 힘입은 바 큼
한편 3월중에는 투신사 수익증권의 수익률 하락, 결산일을 앞둔 종금사의 수익증권 환매 등으로 투신사수신이 크게 둔화됨에 따라 투신사로의 자금집중현상이 완화되고 금융기관간 상호예금이 줄어드는 등 금융시장에서의 자금흐름이 개선되는 모습을 보였음
이와 같은 금융경제상황을 종합적으로 감안하여 4월중 통화정책은 다음과 같은 방향으로 운영함
콜금리는 금융 및 외환시장 여건을 보아가며 시장금리의 하향안정과 은행 대출금리의 꾸준한 하락을 뒷받침할 수 있도록 탄력적으로 운영
본원통화는 은행의 지준수요에 맞추어 신축적으로 공급하되 4월중 공개시장조작을 통한 유동성 조절규모(평잔기준 통안증권발행 및 RP순매각 금액)는 금융시장안정대책자금이 회수된 점 등을 감안하여 조절함
한편 앞으로 공급우위의 외환수급구조하에서 환율절상압력이 과도히 증대되어 실물경제 회복을 저해하지 않도록 적절한 외환시장 수급조절대책을 강구하여야 할 것이며 낮은 금리수준하에서 주식 및 부동산 등 자산시장이 과열되지 않는지 면밀히 관찰해야 할 것임","['국내', '경제', '설연휴', '불구', '생산', '증가', '세', '이어진', '가운데', '소비', '크게', '확대', '되다', '등', '뚜렷하다', '회복', '세', '보이', '있다', '경기', '지수', '등', '선행', '지표', '움직임', '볼', '때', '이러하다', '회복', '세', '지속', '되다', '것', '보임', '그러나', '고용', '정의', '악화', '국제', '유가', '상승', '투자', '심리', '회복', '미흡', '등', '회복', '대한', '내외', '불안', '요인', '잠재', '있다', '물가', '소비자', '물가', '전월', '비다', '폭', '상승', '하다', '생산자', '물가', '하락', '세', '지속', '하다', '등', '안정', '세', '유지', '하다', '앞', '물가', '국제', '유가', '상승', '등', '비용', '측면', '불안', '요인', '있다', '요면', '상승', '압력', '크다', '않다', '대체로', '안정', '세', '유지', '하다', '것', '전망', '되다', '외환', '수급', '경상수지', '흑자', '지속', '되다', '데', '국내', '기업', '해외', '차입', '및', '증권', '발행', '확대', '장기', '자본', '거래', '흑자', '늘어나다', '데', '힘', '입다', '공급', '우위', '규모', '비다', '크게', '확대', '되어다', '이러하다', '추세', '앞', '이어지다', '것', '전망', '되다', '금융시장', '장기시', '금리', '하락', '세', '보이', '은행', '금리', '등', '계속', '하락', '있다', '가운데', '은행', '대출', '확대', '노력', '등', '중소기업', '대출', '꾸준하다', '늘어나다', '있다', '공급', '요인', '의하다', '신용', '경색', '상당', '부분', '해소', '되다', '것', '보임', '다만', '대기업', '대출', '회사채', '발행', '크게', '늘어나다', '않다', '이다', '주로', '기업', '자금', '수요', '둔화', '및', '회사채', '보유', '한', '도제', '등', '기인', '하다', '것', '판단', '되다', '이', '반하다', '주식시장', '통한', '기업', '자금', '조달', '매우', '활발하다', '이다', '기업', '재무', '구조', '개선', '노력', '더불다', '주식시장', '엔화', '환율', '안정', '미국', '등', '해외', '증시', '호조', '국내', '금리', '하락', '등', '증시', '주변', '환경', '개선', '활황', '보이다', '데', '힘', '입다', '바', '크다', '한편', '투', '신사', '수익', '증권', '수익률', '하락', '결산', '일', '앞두다', '종', '금사', '수익', '증권', '환매', '등', '투신', '수신', '크게', '둔화', '되다', '따르다', '투신', '로', '자금', '집중', '현상', '완화', '되다', '금융기관', '상호', '예금', '줄어들다', '등', '금융시장', '자금', '흐름', '개선', '되다', '모습', '보이다', '이', '같다', '금융', '상황', '종합', '감안', '하다', '통화정책', '다음', '같다', '방향', '운영', '함', '콜', '금리', '금융', '및', '외환시장', '여건', '보다', '시장', '금리', '하향', '안정', '은행', '대출', '금리', '꾸준하다', '하락', '뒷받침', '하다', '수', '있다', '탄력', '운영', '본원통화', '은행', '준', '수요', '맞추다', '신축', '공급', '되다', '공개시장', '조작', '통한', '유동성', '조절', '규모', '평잔', '기준', '통안', '증권', '발행', '및', '매각', '금액', '늘다', '금융시장', '안정', '대책', '자금', '회수', '되다', '점', '등', '감안', '하다', '조절', '함', '한편', '앞', '공급', '우위', '외환', '수급', '구조', '환율', '절상', '압력', '과도', '히', '증대', '되어다', '실물', '경제', '회복', '저해', '하다', '않다', '적절하다', '외환시장', '수급', '조절', '대책', '강구', '여야', '하다', '것', '낮다', '금리', '수준', '주식', '및', '부동산', '등', '자산', '시장', '과열', '되다', '않다', '면밀하다', '관찰', '하다', '하다', '것임']"
