,cosine_similarity,dissimilarity,base_rate,base_rate_diff,FFR,ko-us_gap,governor,president,tr1,tr2,raw_statement,stem_statement
2008-04-10,0.8359578358719445,0.1640421641280555,5.0,0.0,2.25,2.75,이성태,이명박,6.79887688604847,7.27103689219383,"금융통화위원회는 다음 통화정책방향 결정시까지 한국은행 기준금리를 현 수준(5.00%)에서 유지하여 통화정책을 운용하기로 하였음
최근 국내 경기는 수출이 호조를 보이고 있으나 내수 증가율이 다소 낮아지면서 상승세가 주춤하고 있는 것으로 판단되며 국제금융시장 불안, 미국 경기 부진 등으로 향후 경기흐름의 불확실성도 높은 상황임
소비자물가는 고유가의 영향 등으로 높은 상승세를 지속하고 있으며 부동산가격은 일부 지역에서 오름세가 확대되었음
금융시장에서는 시중유동성이 풍부한 가운데 금융기관 여신이 증가세를 지속하였으며 국제금융시장 불안의 영향으로 가격변수가 높은 변동성을 나타내었음","['금융통화위원회', '다음', '통화정책', '방향', '결정', '시', '한국은행', '기준금리', '현', '수준', '유지', '하다', '통화정책', '운용', '하다', '하다', '최근', '국내', '경기', '수출', '호조', '보이', '있다', '내', '수', '증가', '율', '다소', '낮아지다', '상승세', '주춤', '있다', '것', '판단', '되다', '국제', '금융시장', '불안', '미국', '경기', '부진', '등', '향후', '흐름', '불확실', '성도', '높다', '상황', '임', '소비자', '물가', '고유', '가의', '영향', '등', '높다', '상승세', '지속', '있다', '부동산', '가격', '일부', '지역', '오르다', '확대', '되어다', '금융시장', '시중', '유동성', '풍부하다', '가운데', '금융기관', '여신', '증가', '세', '지속', '하다', '국제', '금융시장', '불안', '영향', '가격', '변수', '높다', '변동성', '나타내다']"
2008-05-08,0.9195928886986885,0.0804071113013115,5.0,0.0,2.0,3.0,이성태,이명박,6.79887688604847,7.27103689219383,"금융통화위원회는 다음 통화정책방향 결정시까지 한국은행 기준금리를 현 수준(5.00%)에서 유지하여 통화정책을 운용하기로 하였음
최근 국내 경기는 수출이 호조를 보이고 있으나 내수 증가율이 낮아지면서 상승세가 둔화되고 있는 것으로 판단되며 국제금융시장 불안, 미국 경기 부진 등으로 향후 경기흐름의 불확실성도 높은 상황임
소비자물가는 고유가의 영향 등으로 높은 상승세를 지속하고 있으며 부동산가격도 일부 지역에서 오름세를 이어갔음
금융시장에서는 시중유동성이 풍부한 가운데 금융기관 여신이 증가세를 지속하고 장기시장금리가 크게 하락하였음","['금융통화위원회', '다음', '통화정책', '방향', '결정', '시', '한국은행', '기준금리', '현', '수준', '유지', '하다', '통화정책', '운용', '하다', '하다', '최근', '국내', '경기', '수출', '호조', '보이', '있다', '내', '수', '증가', '율', '낮아지다', '상승세', '둔화', '되다', '있다', '것', '판단', '되다', '국제', '금융시장', '불안', '미국', '경기', '부진', '등', '향후', '흐름', '불확실', '성도', '높다', '상황', '임', '소비자', '물가', '고유', '가의', '영향', '등', '높다', '상승세', '지속', '있다', '부동산', '가격', '일부', '지역', '오르다', '이다', '가다', '금융시장', '시중', '유동성', '풍부하다', '가운데', '금융기관', '여신', '증가', '세', '지속', '장기시', '금리', '크게', '하락', '하다']"
2008-06-12,0.882522608121828,0.11747739187817197,5.0,0.0,2.0,3.0,이성태,이명박,6.79887688604847,7.27103689219383,"금융통화위원회는 다음 통화정책방향 결정시까지 한국은행 기준금리를 현 수준(5.00%)에서 유지하여 통화정책을 운용하기로 하였음
최근 국내 경기는 수출이 호조를 보이고 있으나 내수 증가율이 낮은 수준에 머물면서 상승세가 둔화되고 있는 것으로 판단되며 원유가격 상승, 국제금융시장 불안, 미국 경기 부진 등으로 향후 경기흐름의 불확실성도 높은 상황임
소비자물가는 유가 급등의 영향 등으로 오름세가 크게 확대되었으며 부동산가격의 상승률은 다소 낮아졌음
금융시장에서는 시중유동성이 풍부한 가운데 금융기관 여신이 증가세를 지속하였으나 장기시장금리는 크게 상승하였음","['금융통화위원회', '다음', '통화정책', '방향', '결정', '시', '한국은행', '기준금리', '현', '수준', '유지', '하다', '통화정책', '운용', '하다', '하다', '최근', '국내', '경기', '수출', '호조', '보이', '있다', '내', '수', '증가', '율', '낮다', '수준', '머물다', '상승세', '둔화', '되다', '있다', '것', '판단', '되다', '원유', '가격', '상승', '국제', '금융시장', '불안', '미국', '경기', '부진', '등', '향후', '흐름', '불확실', '성도', '높다', '상황', '임', '소비자', '물가', '유가', '급등', '영향', '등', '오르다', '크게', '확대', '되어다', '부동산', '가격', '상', '승률', '다소', '낮아지다', '금융시장', '시중', '유동성', '풍부하다', '가운데', '금융기관', '여신', '증가', '세', '지속', '하다', '장기시', '금리', '크게', '상승', '하다']"
2008-07-10,0.8896203789283669,0.11037962107163313,5.0,0.0,2.0,3.0,이성태,이명박,7.65588264678949,8.33829646098176,"금융통화위원회는 다음 통화정책방향 결정시까지 한국은행 기준금리를 현 수준(5.00%)에서 유지하여 통화정책을 운용하기로 하였음
최근 국내 경기는 수출이 호조를 보이고 있으나 내수 증가율이 낮은 수준에 머물면서 상승세가 약화되고 있는 것으로 판단되며 원유가격 상승, 국제금융시장 불안, 미국 경기 부진 등으로 향후 경기흐름의 불확실성도 높은 상황임
소비자물가는 유가 급등의 영향 등으로 상승세가 더욱 확대되었으며 앞으로도 상당기간 높은 오름세가 지속될 것으로 보임. 한편 부동산가격의 상승세는 제한되고 있음
금융시장에서는 시중유동성이 풍부한 가운데 금융기관 여신이 증가세를 지속하였으나 장기시장금리는 인플레이션에 대한 우려 등으로 더욱 상승하였음","['금융통화위원회', '다음', '통화정책', '방향', '결정', '시', '한국은행', '기준금리', '현', '수준', '유지', '하다', '통화정책', '운용', '하다', '하다', '최근', '국내', '경기', '수출', '호조', '보이', '있다', '내', '수', '증가', '율', '낮다', '수준', '머물다', '상승세', '약화', '되다', '있다', '것', '판단', '되다', '원유', '가격', '상승', '국제', '금융시장', '불안', '미국', '경기', '부진', '등', '향후', '흐름', '불확실', '성도', '높다', '상황', '임', '소비자', '물가', '유가', '급등', '영향', '등', '상승세', '더욱', '확대', '되어다', '앞', '상당', '기간', '높다', '오르다', '지속', '되다', '것', '보임', '한편', '부동산', '가격', '상승세', '제한', '되다', '있다', '금융시장', '시중', '유동성', '풍부하다', '가운데', '금융기관', '여신', '증가', '세', '지속', '하다', '장기시', '금리', '인플레이션', '대한', '우려', '등', '더욱', '상승', '하다']"
2008-08-07,0.8579746186785163,0.14202538132148368,5.25,1.0,2.0,3.25,이성태,이명박,7.65588264678949,8.33829646098176,"금융통화위원회는 다음 통화정책방향 결정시까지 한국은행 기준금리를 현재의 5.00%에서 5.25%로 상향조정하여 통화정책을 운용하기로 하였음
최근 국내 경기는 수출이 호조를 보이고 있으나 내수 증가율이 낮은 수준에 머물면서 둔화되고 있는 것으로 판단되며 국제유가 변동성 확대, 국제금융시장 불안, 미국 경기 부진 등으로 향후 경기흐름의 불확실성도 높은 상황임
소비자물가는 고유가의 영향 파급 등으로 상승세가 한층 확대되었으며 앞으로도 상당기간 높은 오름세가 지속될 것으로 보임. 한편 부동산가격의 상승세는 제한되고 있음
금융시장에서는 시중유동성이 풍부한 가운데 금융기관 여신이 증가세를 지속하였음
이번 기준금리 인상은 높은 물가상승세로 인해 인플레이션 기대심리가 확산될 소지를 줄이기 위한 것임","['금융통화위원회', '다음', '통화정책', '방향', '결정', '시', '한국은행', '기준금리', '현재', '로', '상향', '조정', '통화정책', '운용', '하다', '하다', '최근', '국내', '경기', '수출', '호조', '보이', '있다', '내', '수', '증가', '율', '낮다', '수준', '머물다', '둔화', '되다', '있다', '것', '판단', '되다', '국제', '유가', '변동성', '확대', '국제', '금융시장', '불안', '미국', '경기', '부진', '등', '향후', '흐름', '불확실', '성도', '높다', '상황', '임', '소비자', '물가', '고유', '가의', '영향', '파급', '등', '상승세', '한층', '확대', '되어다', '앞', '상당', '기간', '높다', '오르다', '지속', '되다', '것', '보임', '한편', '부동산', '가격', '상승세', '제한', '되다', '있다', '금융시장', '시중', '유동성', '풍부하다', '가운데', '금융기관', '여신', '증가', '세', '지속', '하다', '이번', '기준금리', '인상', '높다', '물가', '상승세', '인하다', '인플레이션', '심리', '확산', '되다', '소지', '줄이다', '위', '것임']"
2008-09-11,0.8323591239042439,0.16764087609575606,5.25,0.0,2.0,3.25,이성태,이명박,7.65588264678949,8.33829646098176,"금융통화위원회는 다음 통화정책방향 결정시까지 한국은행 기준금리를 현 수준(5.25%)에서 유지하여 통화정책을 운용하기로 하였음
최근 국내 경기는 수출이 호조를 보이고 있으나 내수 저조로 인해 둔화 움직임을 지속하고 있는 것으로 판단되며 국제금융시장 불안, 미국 경기 부진 등으로 향후 경기흐름의 불확실성도 높은 상황임
소비자물가는 국제유가 하락의 영향으로 상승률이 소폭 낮아졌으나 앞으로 상당기간 높은 오름세가 지속될 것으로 보임. 한편 부동산가격의 상승세는 제한되고 있음
금융시장에서는 시중유동성이 풍부하고 금융기관 여신도 꾸준히 증가하였으나 시장참가자들의 불안심리 등으로 가격변수가 높은 변동성을 나타내었음","['금융통화위원회', '다음', '통화정책', '방향', '결정', '시', '한국은행', '기준금리', '현', '수준', '유지', '하다', '통화정책', '운용', '하다', '하다', '최근', '국내', '경기', '수출', '호조', '보이', '있다', '내', '수', '저조', '인하다', '둔화', '움직임', '지속', '있다', '것', '판단', '되다', '국제', '금융시장', '불안', '미국', '경기', '부진', '등', '향후', '흐름', '불확실', '성도', '높다', '상황', '임', '소비자', '물가', '국제', '유가', '하락', '영향', '상', '승률', '폭', '낮아지다', '앞', '상당', '기간', '높다', '오르다', '지속', '되다', '것', '보임', '한편', '부동산', '가격', '상승세', '제한', '되다', '있다', '금융시장', '시중', '유동성', '풍부하다', '금융기관', '여신', '꾸준하다', '증가', '하다', '시장', '참가자', '불안', '심리', '등', '가격', '변수', '높다', '변동성', '나타내다']"
2008-10-09,0.7821341248535223,0.2178658751464777,5.0,1.0,1.5,3.5,이성태,이명박,3.34757793688905,7.60582062275523,"금융통화위원회는 다음 통화정책방향 결정시까지 한국은행 기준금리를 현재의 5.25%에서 5.00%로 하향조정하여 통화정책을 운용하기로 하였음
최근 국내 경기는 수출이 높은 신장세를 지속하고 있으나 내수 부진으로 인해 둔화 움직임이 뚜렷해지고 있으며 국제금융시장 불안, 세계 경기 위축 등으로 향후 성장의 하향리스크도 높아진 것으로 판단됨
소비자물가는 국제유가 하락의 영향으로 상승률이 점차 낮아지고 있으나 원/달러 환율 상승 등에 기인하여 당분간 높은 오름세를 나타낼 것으로 보임. 한편 부동산가격의 상승세는 제한되고 있음
금융시장에서는 국제금융시장 불안 확산의 영향으로 환율, 주가 등 가격변수가 불안정한 움직임을 보이는 가운데 금융기관의 여신태도가 강화되고 있음
이번 기준금리 인하는 금융시장 불안을 완화하고 경기가 과도하게 위축되지 않도록 하기 위한 것임","['금융통화위원회', '다음', '통화정책', '방향', '결정', '시', '한국은행', '기준금리', '현재', '로', '하향', '조정', '통화정책', '운용', '하다', '하다', '최근', '국내', '경기', '수출', '높다', '신장', '세', '지속', '있다', '내', '수', '부진', '인하다', '둔화', '움직임', '뚜렷하다', '있다', '국제', '금융시장', '불안', '세계', '경기', '위축', '등', '향후', '성장', '하향', '리스크', '높아지다', '것', '판단', '되다', '소비자', '물가', '국제', '유가', '하락', '영향', '상', '승률', '점차', '낮아지다', '있다', '원', '달러', '환율', '상승', '등', '기인', '하다', '당분간', '높다', '오르다', '나타내다', '것', '보임', '한편', '부동산', '가격', '상승세', '제한', '되다', '있다', '금융시장', '국제', '금융시장', '불안', '확산', '영향', '환율', '주가', '등', '가격', '변수', '불안정하다', '움직임', '보이다', '가운데', '금융기관', '태도', '강화', '되다', '있다', '이번', '기준금리', '인하다', '금융시장', '불안', '완화', '경기', '과도', '하다', '위축', '되다', '않다', '하다', '위', '것임']"
2008-11-07,0.8212630929949859,0.1787369070050141,4.0,1.0,1.0,3.0,이성태,이명박,3.34757793688905,7.60582062275523,"금융통화위원회는 다음 통화정책방향 결정시까지 한국은행 기준금리를 현재의 4.25%에서 4.00%로 하향조정하여 통화정책을 운용하기로 하였음
최근 국내 경기는 세계경제 성장세 약화로 인해 수출증가율이 낮아지고 소비 등 내수가 부진한 모습을 보이면서 둔화추세를 지속하고 있으며 금융시장 불안의 파급 영향이 가세하여 향후 성장의 하향위험도 큰 것으로 판단됨
소비자물가는 원/달러 환율 상승에도 불구하고 국제유가 하락과 경기둔화의 영향으로 오름세가 점차 둔화되고 있음. 부동산시장에서는 거래가 위축된 가운데 가격이 하락 움직임을 나타내고 있음
금융시장에서는 환율, 주가 등 가격변수의 불안정한 움직임이 지속되는 가운데 외국인 투자자금 유출, 금융기관 여신태도 강화 등으로 기업의 자금조달 여건이 악화되고 있음
앞으로도 통화정책은 물가상승압력의 변화와 함께 금융시장 불안 등에 따른 경기의 과도한 위축 가능성에 유의하면서 운용해 나갈 것임","['금융통화위원회', '다음', '통화정책', '방향', '결정', '시', '한국은행', '기준금리', '현재', '로', '하향', '조정', '통화정책', '운용', '하다', '하다', '최근', '국내', '경기', '세계', '경제', '성장', '세', '약화', '인하다', '수출', '증가', '율', '낮아지다', '소비', '등', '내', '수가', '부진하다', '모습', '보이다', '둔화', '추세', '지속', '있다', '금융시장', '불안', '파급', '영향', '가세', '하다', '향후', '성장', '하향', '위험', '크다', '것', '판단', '되다', '소비자', '물가', '원', '달러', '환율', '상승', '불구', '국제', '유가', '하락', '둔화', '영향', '오르다', '점차', '둔화', '되다', '있다', '부동산', '시장', '거래', '위축', '되다', '가운데', '가격', '하락', '움직임', '나타내다', '있다', '금융시장', '환율', '주가', '등', '가격', '변수', '불안정하다', '움직임', '지속', '되다', '가운데', '외국인', '투자', '자금', '유출', '금융기관', '여신', '태도', '강화', '등', '기업', '자금', '조달', '여건', '악화', '되다', '있다', '앞', '통화정책', '물가', '상승', '압력', '변화', '함께', '금융시장', '불안', '등', '따르다', '경기', '과도', '위축', '가능성', '유의', '하다', '운용', '하다', '나가다', '것임']"
2008-12-11,0.8536867506397614,0.1463132493602386,3.0,1.0,1.0,2.0,이성태,이명박,3.34757793688905,7.60582062275523,"금융통화위원회는 다음 통화정책방향 결정시까지 한국은행 기준금리를 현재의 4.00%에서 3.00%로 하향조정하여 통화정책을 운용하기로 하였음
최근 국내 경기는 소비, 투자 등 내수 부진이 심화되는 데다 수출도 감소로 돌아서면서 빠르게 둔화되고 있으며 신용경색 등 금융시장 불안과 함께 세계경제의 침체로 향후 성장이 크게 위축될 가능성이 높은 것으로 판단됨
소비자물가는 원/달러 환율 상승에도 불구하고 국제유가 하락과 경기둔화의 영향으로 오름세가 계속 둔화되고 있음. 부동산시장에서는 거래 위축 및 가격 하락 현상이 지속되고 있음
금융시장에서는 환율, 주가 등 가격변수가 높은 변동성을 보이는 가운데 외국인 투자자금 유출 및 금융기관의 여신태도 강화 지속 등으로 기업의 자금조달 여건이 악화되고 있음
앞으로 통화정책은 유동성 상황을 개선하고 경기의 과도한 위축을 방지하는 데 주안점을 두고 운용해 나갈 것임","['금융통화위원회', '다음', '통화정책', '방향', '결정', '시', '한국은행', '기준금리', '현재', '로', '하향', '조정', '통화정책', '운용', '하다', '하다', '최근', '국내', '경기', '소비', '투자', '등', '내', '수', '부진', '심화', '되다', '데', '수출', '감소', '돌아서다', '빠르다', '둔화', '되다', '있다', '신용', '경색', '등', '금융시장', '불안', '함께', '세계', '경제', '침체', '향후', '성장', '크게', '위축', '되다', '가능성', '높다', '것', '판단', '되다', '소비자', '물가', '원', '달러', '환율', '상승', '불구', '국제', '유가', '하락', '둔화', '영향', '오르다', '계속', '둔화', '되다', '있다', '부동산', '시장', '거래', '위축', '및', '가격', '하락', '현상', '지속', '되다', '있다', '금융시장', '환율', '주가', '등', '가격', '변수', '높다', '변동성', '보이다', '가운데', '외국인', '투자', '자금', '유출', '및', '금융기관', '여신', '태도', '강화', '지속', '등', '기업', '자금', '조달', '여건', '악화', '되다', '있다', '앞', '통화정책', '유동성', '상황', '개선', '경기', '과도', '위축', '방지', '하다', '데', '주안', '점', '두다', '운용', '하다', '나가다', '것임']"
2009-01-10,0.8509814473689763,0.1490185526310237,2.5,1.0,0.125,2.375,이성태,이명박,2.47425081480661,5.41941845431967,"금융통화위원회는 다음 통화정책방향 결정시까지 한국은행 기준금리를 현재의 3.00%에서 2.50%로 하향조정하여 통화정책을 운용하기로 하였음
최근 국내 경기는 소비, 투자 등 내수 부진이 한층 심화되고 세계경제의 침체로 수출도 큰 폭으로 감소하면서 급속히 위축되고 있으며 신용경색 등 금융시장 불안 지속으로 향후 성장의 하향위험도 큰 것으로 판단됨
소비자물가는 국제유가의 하락과 경기부진의 영향으로 오름세가 계속 둔화되고 있으며 앞으로도 이러한 추세가 이어질 것으로 보임. 부동산시장에서는 거래 위축 및 가격 하락 현상이 지속되고 있음
금융시장에서는 환율, 주가 등 가격변수의 불안정성이 다소 완화되었으나 신용위험을 우려한 금융기관의 보수적 자금 운용으로 기업이 자금조달에 큰 어려움을 겪고 있음
앞으로 통화정책은 유동성 상황을 개선하고 경기의 과도한 위축을 방지하는 데 주안점을 두고 운용해 나갈 것임","['금융통화위원회', '다음', '통화정책', '방향', '결정', '시', '한국은행', '기준금리', '현재', '로', '하향', '조정', '통화정책', '운용', '하다', '하다', '최근', '국내', '경기', '소비', '투자', '등', '내', '수', '부진', '한층', '심화', '되다', '세계', '경제', '침체', '수출', '크다', '폭', '감소', '하다', '급속하다', '위축', '되다', '있다', '신용', '경색', '등', '금융시장', '불안', '지속', '향후', '성장', '하향', '위험', '크다', '것', '판단', '되다', '소비자', '물가', '국제', '유가', '하락', '부진', '영향', '오르다', '계속', '둔화', '되다', '있다', '앞', '이러하다', '추세', '이어지다', '것', '보임', '부동산', '시장', '거래', '위축', '및', '가격', '하락', '현상', '지속', '되다', '있다', '금융시장', '환율', '주가', '등', '가격', '변수', '불안', '정성', '다소', '완화', '되어다', '신용', '위험', '우려', '금융기관', '보수', '자금', '운용', '기업', '자금', '조달', '크다', '어려움', '겪다', '있다', '앞', '통화정책', '유동성', '상황', '개선', '경기', '과도', '위축', '방지', '하다', '데', '주안', '점', '두다', '운용', '하다', '나가다', '것임']"
2009-02-12,0.9190565203790857,0.0809434796209143,2.0,1.0,0.125,1.875,이성태,이명박,2.47425081480661,5.41941845431967,"금융통화위원회는 다음 통화정책방향 결정시까지 한국은행 기준금리를 현재의 2.50%에서 2.00%로 하향조정하여 통화정책을 운용하기로 하였음
최근 국내 경기는 소비, 투자 등 내수가 한층 더 위축되고 수출이 급격히 감소하면서 하강속도가 빨라지고 있으며 세계경제 침체 심화 및 신용경색 지속 가능성 등으로 향후 성장의 하향위험도 매우 큰 것으로 판단됨
소비자물가는 국제유가의 하향 안정과 경기부진의 영향으로 오름세가 계속 둔화되고 있으며 앞으로도 이러한 추세가 이어질 것으로 보임. 부동산시장에서는 거래 위축 및 가격 하락 현상이 지속되고 있음
금융시장에서는 환율, 주가 등 가격변수가 대체로 안정적인 움직임을 보였으나 신용위험을 우려한 금융기관의 보수적 자금운용으로 기업이 자금조달에 여전히 어려움을 겪고 있음
앞으로 통화정책은 유동성 상황을 개선하고 경기의 과도한 위축을 방지하는 데 주안점을 두고 운용해 나갈 것임","['금융통화위원회', '다음', '통화정책', '방향', '결정', '시', '한국은행', '기준금리', '현재', '로', '하향', '조정', '통화정책', '운용', '하다', '하다', '최근', '국내', '경기', '소비', '투자', '등', '내', '수가', '한층', '더', '위축', '되다', '수출', '급격하다', '감소', '하다', '하강', '속도', '빨르다', '있다', '세계', '경제', '침체', '심화', '및', '신용', '경색', '지속', '가능성', '등', '향후', '성장', '하향', '위험', '매우', '크다', '것', '판단', '되다', '소비자', '물가', '국제', '유가', '하향', '안정', '부진', '영향', '오르다', '계속', '둔화', '되다', '있다', '앞', '이러하다', '추세', '이어지다', '것', '보임', '부동산', '시장', '거래', '위축', '및', '가격', '하락', '현상', '지속', '되다', '있다', '금융시장', '환율', '주가', '등', '가격', '변수', '대체로', '안정', '움직임', '보이다', '신용', '위험', '우려', '금융기관', '보수', '자금', '운용', '기업', '자금', '조달', '여전하다', '어려움', '겪다', '있다', '앞', '통화정책', '유동성', '상황', '개선', '경기', '과도', '위축', '방지', '하다', '데', '주안', '점', '두다', '운용', '하다', '나가다', '것임']"
