,cosine_similarity,dissimilarity,base_rate,base_rate_diff,FFR,ko-us_gap,governor,president,tr1,tr2,raw_statement,stem_statement
2018-10-18,0.9488805778972212,0.051119422102778755,1.5,0.0,2.125,-0.625,이주열,문재인,3.08725727279166,3.17469902895334,"금융통화위원회는 다음 통화정책방향 결정시까지 한국은행 기준금리를 현 수준(1.50%)에서 유지하여 통화정책을 운용하기로 하였다.
세계경제는 양호한 성장세를 지속하였다. 국제금융시장에서는 주요국의 국채금리가 상승하고 주가가 하락하는 등 변동성이 확대되었다. 앞으로 세계경제의 성장세는 보호무역주의 확산 움직임, 주요국 통화정책 정상화 속도, 미국 정부 정책방향 등에 영향받을 것으로 보인다.
국내경제는 설비 및 건설 투자의 조정이 지속되었으나 소비와 수출이 양호한 흐름을 보이면서 대체로 잠재성장률 수준의 성장세를 이어간 것으로 판단된다. 고용 상황은 취업자수 증가규모가 소폭에 그치는 등 계속 부진한 모습을 보였다. 앞으로 국내경제의 성장 흐름은 지난 7월 전망경로를 다소 하회하겠지만 잠재성장률 수준에서 크게 벗어나지 않는 성장세가 유지될 것으로 예상된다. 투자가 둔화되겠으나 소비는 꾸준한 증가세를 이어가고 수출도 세계경제의 호조에 힘입어 양호한 흐름을 지속할 것으로 예상된다.
소비자물가는 농산물가격 상승세 확대, 전기요금 한시 인하 종료 등으로 오름세가 1%대 후반으로 높아졌다. 근원인플레이션율(식료품 및 에너지 제외 지수)은 1% 수준을 지속하였으며 일반인 기대인플레이션율은 2%대 중후반을 나타내었다. 앞으로 소비자물가 상승률은 1%대 중후반에서 등락할 것으로 전망된다. 근원인플레이션율도 완만하게 상승할 것으로 보인다.
금융시장에서는 미·중 무역분쟁 심화, 글로벌 주가 급락 등으로 주가가 큰 폭 하락하고 원/달러 환율은 상당폭 상승하였다. 장기시장금리는 주요국 금리의 움직임 등을 반영하여 상승하였다. 가계대출은 증가규모가 다소 축소되었으나 예년보다 높은 증가세를 지속하였다. 주택가격은 수도권 일부 지역을 중심으로 높은 오름세를 나타내다가 정부의 주택시장 안정대책 발표 이후 상승세가 둔화되었다.
금융통화위원회는 앞으로 성장세 회복이 이어지고 중기적 시계에서 물가상승률이 목표수준에서 안정될 수 있도록 하는 한편 금융안정에 유의하여 통화정책을 운용해 나갈 것이다. 국내경제가 잠재성장률 수준에서 크게 벗어나지 않는 성장세를 지속하는 가운데 당분간 수요 측면에서의 물가상승압력은 크지 않을 것으로 전망되므로 통화정책의 완화기조를 유지해 나갈 것이다. 이 과정에서 향후 성장과 물가의 흐름을 면밀히 점검하면서 완화정도의 조정 여부를 판단해 나갈 것이다. 아울러 주요국과의 교역여건, 주요국 중앙은행의 통화정책 변화, 신흥시장국 금융·경제상황, 가계부채 증가세, 지정학적 리스크 등도 주의깊게 살펴볼 것이다.","['금융통화위원회', '다음', '통화정책', '방향', '결정', '시', '한국은행', '기준금리', '현', '수준', '유지', '하다', '통화정책', '운용', '하다', '하다', '세계', '경제', '양호', '성장', '세', '지속', '하다', '국제', '금융시장', '국', '국채', '금리', '상승', '주가', '하락', '하다', '등', '변동성', '확대', '되어다', '앞', '세계', '경제', '성장', '세다', '보호무역', '주의', '확산', '움직임', '국', '통화정책', '정상화', '속도', '미국', '정부', '정책', '방향', '등', '영향', '받다', '것', '보이다', '국내', '경제', '설비', '및', '건설', '투자', '조정', '지속', '되어다', '소비', '수출', '양호', '흐름', '보이다', '대체로', '잠재', '성장', '률', '수준', '성장', '세', '이', '어간', '것', '판단', '되다', '고용', '상황', '취업', '자수', '증가', '규모', '폭', '그치다', '등', '계속', '부진하다', '모습', '보이다', '앞', '국내', '경제', '성장', '흐름', '지난', '전망', '경로', '다소', '회하', '겠다', '잠재', '성장', '률', '수준', '크게', '벗어나다', '않다', '성장', '세', '유지', '되다', '것', '예상', '되다', '투자가', '둔화', '되다', '소비', '꾸준하다', '증가', '세', '이', '어가', '수출', '세계', '경제', '호조', '힘', '입다', '양호', '흐름', '지속', '하다', '것', '예상', '되다', '소비자', '물가', '농산물', '가격', '상승세', '확대', '전기요금', '한시', '인하', '종료', '등', '오르다', '대다', '후반', '높아지다', '근원', '인플레이션율', '식료품', '및', '에너지', '제외', '지수', '은', '수준', '지속', '하다', '일반인', '인플레이션율', '대다', '중후', '반', '나타내다', '앞', '소비자', '물가', '상', '승률', '대다', '중후', '반', '등락', '하다', '것', '전망', '되다', '인플레이션율', '완만', '하다', '상승', '하다', '것', '보이다', '금융시장', '밉다', '중', '무역', '분쟁', '심화', '글로벌', '주가', '급락', '등', '주가', '크다', '폭', '하락', '원', '달러', '환율', '상당', '폭', '상승', '하다', '장기시', '금리', '국', '금리', '움직임', '등', '반영', '하다', '상승', '하다', '가계', '대출', '증가', '규모', '다소', '축소', '되어다', '예년', '높다', '증가', '세', '지속', '하다', '주택', '가격', '수도권', '일부', '지역', '중심', '높다', '오르다', '나타내다', '정부', '주택', '시장', '안정', '대책', '발표', '이후', '상승세', '둔화', '되어다', '금융통화위원회', '앞', '성장', '세', '회복', '이어지다', '중', '기적', '시계', '물가상승률', '목표', '수준', '안정', '되다', '수', '있다', '하다', '한편', '금융', '안정', '유의', '하다', '통화정책', '운용', '하다', '나가다', '것', '국내', '경제', '잠재', '성장', '률', '수준', '크게', '벗어나다', '않다', '성장', '세', '지속', '하다', '가운데', '당분간', '수요', '측면', '물가', '상승', '압력', '크다', '않다', '것', '전망', '되다', '통화정책', '완화', '기조', '유지', '하다', '나가다', '것', '이', '과정', '향후', '성장', '물가', '흐름', '면밀하다', '점검', '하다', '완화', '정도', '조정', '여부', '판단', '하다', '나가다', '것', '아우르다', '국', '교역', '여건', '국', '중앙은행', '통화정책', '변화', '신흥시장', '국', '금융', '경제', '상황', '가계부채', '증가', '세', '지정학적', '리스크', '등', '주의', '깊다', '살펴보다', '것']"
2018-11-30,0.9521473550202396,0.047852644979760384,1.75,1.0,2.125,-0.375,이주열,문재인,3.08725727279166,3.17469902895334,"금융통화위원회는 다음 통화정책방향 결정시까지 한국은행 기준금리를 현재의 1.50%에서 1.75%로 상향 조정하여 통화정책을 운용하기로 하였다.
세계경제는 3/4분기중 성장세가 다소 약화되는 모습을 보였으나 대체로 양호한 성장흐름을 이어가고 있는 것으로 보인다. 국제금융시장에서는 주요국 주가가 하락하는 등 높은 변동성이 지속되었으나 일부 취약 신흥국의 금융불안은 다소 완화되었다. 앞으로 세계경제와 국제금융시장은 보호무역주의 확산 움직임, 주요국 통화정책 정상화 속도, 유로지역 정치적 불확실성 등에 영향받을 것으로 보인다.
국내경제는 설비 및 건설투자의 조정이 지속되었으나 소비가 완만한 증가세를 이어가고 수출도 양호한 흐름을 지속하면서 대체로 잠재성장률 수준의 성장세를 이어간 것으로 판단된다. 고용 상황은 취업자수 증가규모가 소폭 늘어나는 등 부진이 다소 완화되는 모습을 보였다. 앞으로 국내경제의 성장흐름은 지난 10월 전망경로와 대체로 부합하여 잠재성장률 수준에서 크게 벗어나지 않는 성장세가 유지될 것으로 예상된다. 투자가 둔화되겠으나 소비는 꾸준한 증가세를 이어가고 수출도 세계경제의 호조에 힘입어 양호한 흐름을 지속할 것으로 예상된다.
소비자물가는 농산물 및 석유류 가격의 상승폭이 확대되면서 2% 수준을 나타내었다. 근원인플레이션율(식료품 및 에너지 제외 지수)은 1% 내외 수준을, 일반인 기대인플레이션율은 2%대 중반 수준을 나타내었다. 앞으로 소비자물가 상승률은 당분간 목표수준 내외를 보이다가 다소 낮아져 1%대 중후반에서 등락할 것으로 전망된다. 근원인플레이션율은 완만하게 상승할 것으로 보인다.
금융시장에서는 주요 가격변수의 변동성이 확대되었다가 11월 들어 다소 축소되었다. 주가는 주요국 주가 하락, 미·중 무역분쟁 완화 기대 등에 따라 상당폭 하락 후 반등하였으며, 장기시장금리는 하락하였다. 원/달러 환율은 소폭 하락하였다. 가계대출은 10월 들어 증가규모가 확대되었으며, 주택가격은 정부의 주택시장 안정대책의 영향으로 오름세가 둔화되었다.
금융통화위원회는 앞으로 성장세 회복이 이어지고 중기적 시계에서 물가상승률이 목표수준에서 안정될 수 있도록 하는 한편 금융안정에 유의하여 통화정책을 운용해 나갈 것이다. 국내경제가 잠재성장률 수준에서 크게 벗어나지 않는 성장세를 지속하는 가운데 당분간 수요 측면에서의 물가상승압력은 크지 않을 것으로 전망되므로 통화정책의 완화기조를 유지해 나갈 것이다. 이 과정에서 향후 성장과 물가의 흐름을 면밀히 점검하면서 완화정도의 추가 조정 여부를 판단해 나갈 것이다. 아울러 주요국과의 교역여건, 주요국 중앙은행의 통화정책 변화, 신흥시장국 금융·경제상황, 가계부채 증가세, 지정학적 리스크 등도 주의깊게 살펴볼 것이다.","['금융통화위원회', '다음', '통화정책', '방향', '결정', '시', '한국은행', '기준금리', '현재', '로', '상향', '조정', '하다', '통화정책', '운용', '하다', '하다', '세계', '경제', '성장', '세', '다소', '약화', '되다', '모습', '보이다', '대체로', '양호', '성장', '흐름', '이', '어가', '있다', '것', '보이다', '국제', '금융시장', '국', '주가', '하락', '하다', '등', '높다', '변동성', '지속', '되어다', '일부', '취약', '신흥', '국', '금융', '불안', '다소', '완화', '되어다', '앞', '세계', '경제', '국제', '금융시장', '보호무역', '주의', '확산', '움직임', '국', '통화정책', '정상화', '속도', '유로', '지역', '정치', '불확실', '등', '영향', '받다', '것', '보이다', '국내', '경제', '설비', '및', '건설', '투자', '조정', '지속', '되어다', '소비', '완만', '증가', '세', '이', '어가', '수출', '양호', '흐름', '지속', '하다', '대체로', '잠재', '성장', '률', '수준', '성장', '세', '이', '어간', '것', '판단', '되다', '고용', '상황', '취업', '자수', '증가', '규모', '폭', '늘어나다', '등', '부진', '다소', '완화', '되다', '모습', '보이다', '앞', '국내', '경제', '성장', '흐름', '지난', '전망', '경로', '대체로', '부합', '하다', '잠재', '성장', '률', '수준', '크게', '벗어나다', '않다', '성장', '세', '유지', '되다', '것', '예상', '되다', '투자가', '둔화', '되다', '소비', '꾸준하다', '증가', '세', '이', '어가', '수출', '세계', '경제', '호조', '힘', '입다', '양호', '흐름', '지속', '하다', '것', '예상', '되다', '소비자', '물가', '농산물', '및', '유류', '가격', '상승', '폭', '확대', '되다', '수준', '나타내다', '근원', '인플레이션율', '식료품', '및', '에너지', '제외', '지수', '은', '내외', '수준', '일반인', '인플레이션율', '대다', '중반', '수준', '나타내다', '앞', '소비자', '물가', '상', '승률', '당분간', '목표', '수준', '내외', '보이다', '다소', '낮아지다', '대다', '중후', '반', '등락', '하다', '것', '전망', '되다', '인플레이션율', '완만', '하다', '상승', '하다', '것', '보이다', '금융시장', '주요', '가격', '변수', '변동성', '확대', '되어다', '들다', '다소', '축소', '되어다', '주가', '국', '주가', '하락', '밉다', '중', '무역', '분쟁', '완화', '기대', '등', '따르다', '상당', '폭', '하락', '후', '반등', '하다', '장기시', '금리', '하락', '하다', '원', '달러', '환율', '폭', '하락', '하다', '가계', '대출', '들다', '증가', '규모', '확대', '되어다', '주택', '가격', '정부', '주택', '시장', '안정', '대책', '영향', '오르다', '둔화', '되어다', '금융통화위원회', '앞', '성장', '세', '회복', '이어지다', '중', '기적', '시계', '물가상승률', '목표', '수준', '안정', '되다', '수', '있다', '하다', '한편', '금융', '안정', '유의', '하다', '통화정책', '운용', '하다', '나가다', '것', '국내', '경제', '잠재', '성장', '률', '수준', '크게', '벗어나다', '않다', '성장', '세', '지속', '하다', '가운데', '당분간', '수요', '측면', '물가', '상승', '압력', '크다', '않다', '것', '전망', '되다', '통화정책', '완화', '기조', '유지', '하다', '나가다', '것', '이', '과정', '향후', '성장', '물가', '흐름', '면밀하다', '점검', '하다', '완화', '정도', '추가', '조정', '여부', '판단', '하다', '나가다', '것', '아우르다', '국', '교역', '여건', '국', '중앙은행', '통화정책', '변화', '신흥시장', '국', '금융', '경제', '상황', '가계부채', '증가', '세', '지정학적', '리스크', '등', '주의', '깊다', '살펴보다', '것']"
2019-01-24,0.9346532753182056,0.06534672468179437,1.75,0.0,2.375,-0.625,이주열,문재인,0.591670253056199,1.11676619468466,"금융통화위원회는 다음 통화정책방향 결정시까지 한국은행 기준금리를 현 수준(1.75%)에서 유지하여 통화정책을 운용하기로 하였다.
세계경제는 성장세가 다소 완만해지는 움직임을 나타내었다. 국제금융시장에서는 금년 들어 미 연준의 정책금리 인상 속도 조절 가능성, 미·중 무역협상 진전 기대 등으로 그간 확대되었던 변동성이 다소 축소되었다. 앞으로 세계경제와 국제금융시장은 보호무역주의 확산 정도, 주요국 통화정책 정상화 속도, 브렉시트 관련 불확실성 등에 영향받을 것으로 보인다.
국내경제는 설비 및 건설투자의 조정이 이어졌으나 소비와 수출의 증가세가 지속되면서 대체로 잠재성장률 수준의 성장세를 이어간 것으로 판단된다. 고용 상황은 12월 취업자수 증가규모가 상당폭 축소되는 등 부진한 모습을 보였다. 앞으로 국내경제의 성장흐름은 지난해 10월 전망경로를 소폭 하회하겠지만 정부지출 확대 등으로 잠재성장률 수준에서 크게 벗어나지 않는 성장세가 유지될 것으로 예상된다.
소비자물가는 석유류가격 하락, 농축수산물가격 상승폭 축소 등으로 1%대 초반으로 오름세가 둔화되었다. 근원인플레이션율(식료품 및 에너지 제외 지수)은 1%대 초반 수준을, 일반인 기대인플레이션율은 2%대 중반 수준을 나타내었다. 앞으로 소비자물가 상승률은 당분간 1% 수준에서 등락하다가 점차 높아져 하반기 이후 1%대 중반을 보일 것으로 전망된다. 근원인플레이션율도 완만하게 상승할 것으로 보인다.
금융시장은 지난해 12월중 변동성이 확대되었다가 금년 들어서는 대체로 안정된 모습을 보였다. 주가는 글로벌 경기둔화 우려로 하락한 후 미·중 무역분쟁 완화 기대 등으로 반등하였으며, 장기시장금리는 하락 후 소폭 등락하였다. 원/달러 환율은 좁은 범위 내에서 등락하면서 안정세를 보였다. 가계대출은 증가규모가 축소되었으며, 주택가격은 둔화세가 이어졌다.
금융통화위원회는 앞으로 성장세 회복이 이어지고 중기적 시계에서 물가상승률이 목표수준에서 안정될 수 있도록 하는 한편 금융안정에 유의하여 통화정책을 운용해 나갈 것이다. 국내경제가 잠재성장률 수준에서 크게 벗어나지 않는 성장세를 지속하는 가운데 당분간 수요 측면에서의 물가상승압력은 크지 않을 것으로 전망되므로 통화정책의 완화기조를 유지해 나갈 것이다. 이 과정에서 완화정도의 추가 조정 여부는 향후 성장과 물가의 흐름을 면밀히 점검하면서 판단해 나갈 것이다. 아울러 주요국과의 교역여건, 주요국 중앙은행의 통화정책 변화, 신흥시장국 금융·경제상황, 가계부채 증가세, 지정학적 리스크 등도 주의깊게 살펴볼 것이다.","['금융통화위원회', '다음', '통화정책', '방향', '결정', '시', '한국은행', '기준금리', '현', '수준', '유지', '하다', '통화정책', '운용', '하다', '하다', '세계', '경제', '성장', '세', '다소', '완만', '하다', '움직임', '나타내다', '국제', '금융시장', '금년', '들다', '밉다', '준', '정책', '금리', '인상', '속도', '조절', '가능성', '밉다', '중', '무역', '협상', '진전', '기대', '등', '그간', '확대', '되어다', '변동성', '다소', '축소', '되어다', '앞', '세계', '경제', '국제', '금융시장', '보호무역', '주의', '확산', '정도', '국', '통화정책', '정상화', '속도', '브렉', '시트', '관련', '불확실', '등', '영향', '받다', '것', '보이다', '국내', '경제', '설비', '및', '건설', '투자', '조정', '이어지다', '소비', '수출', '증가', '세', '지속', '되다', '대체로', '잠재', '성장', '률', '수준', '성장', '세', '이', '어간', '것', '판단', '되다', '고용', '상황', '취업', '자수', '증가', '규모', '상당', '폭', '축소', '되다', '등', '부진하다', '모습', '보이다', '앞', '국내', '경제', '성장', '흐름', '지난해', '전망', '경로', '폭', '회하', '겠다', '정부', '지출', '확대', '등', '잠재', '성장', '률', '수준', '크게', '벗어나다', '않다', '성장', '세', '유지', '되다', '것', '예상', '되다', '소비자', '물가', '유류', '가격', '하락', '농축', '수산물', '가격', '상승', '폭', '축소', '등', '대다', '초반', '오르다', '둔화', '되어다', '근원', '인플레이션율', '식료품', '및', '에너지', '제외', '지수', '은', '대다', '초반', '수준', '일반인', '인플레이션율', '대다', '중반', '수준', '나타내다', '앞', '소비자', '물가', '상', '승률', '당분간', '수준', '등락', '하다', '점차', '높아지다', '하반기', '이후', '대다', '중반', '보이다', '것', '전망', '되다', '인플레이션율', '완만', '하다', '상승', '하다', '것', '보이다', '금융시장', '지난해', '변동성', '확대', '되어다', '금년', '들어서다', '대체로', '안정', '되다', '모습', '보이다', '주가', '글로벌', '경기', '둔화', '우려', '하락', '후', '밉다', '중', '무역', '분쟁', '완화', '기대', '등', '반등', '하다', '장기시', '금리', '하락', '후', '폭', '등락', '하다', '원', '달러', '환율', '좁다', '범위', '내', '등락', '하다', '안정', '세', '보이다', '가계', '대출', '증가', '규모', '축소', '되어다', '주택', '가격', '둔화', '세', '이어지다', '금융통화위원회', '앞', '성장', '세', '회복', '이어지다', '중', '기적', '시계', '물가상승률', '목표', '수준', '안정', '되다', '수', '있다', '하다', '한편', '금융', '안정', '유의', '하다', '통화정책', '운용', '하다', '나가다', '것', '국내', '경제', '잠재', '성장', '률', '수준', '크게', '벗어나다', '않다', '성장', '세', '지속', '하다', '가운데', '당분간', '수요', '측면', '물가', '상승', '압력', '크다', '않다', '것', '전망', '되다', '통화정책', '완화', '기조', '유지', '하다', '나가다', '것', '이', '과정', '완화', '정도', '추가', '조정', '여부', '향후', '성장', '물가', '흐름', '면밀하다', '점검', '하다', '판단', '하다', '나가다', '것', '아우르다', '국', '교역', '여건', '국', '중앙은행', '통화정책', '변화', '신흥시장', '국', '금융', '경제', '상황', '가계부채', '증가', '세', '지정학적', '리스크', '등', '주의', '깊다', '살펴보다', '것']"
