,cosine_similarity,dissimilarity,base_rate,base_rate_diff,FFR,ko-us_gap,governor,president,tr1,tr2,raw_statement,stem_statement
2014-03-13,0.9491542174130765,0.050845782586923516,2.5,0.0,0.125,2.375,김중수,박근혜,1.74832132293324,0.134564758252044,"금융통화위원회는 다음 통화정책방향 결정시까지 한국은행 기준금리를 현 수준(2.50%)에서 유지하여 통화정책을 운용하기로 하였다.
세계경제를 보면, 미국에서는 경기회복세가 지속되었고 유로지역에서는 경기부진이 완화되는 모습을 이어갔으며 신흥시장국에서는 일부 국가의 성장세가 다소 약화되는 움직임을 나타내었다. 앞으로 세계경제는 완만한 회복세를 지속할 것으로 전망되나, 미 연준의 양적완화 축소에 따른 글로벌 금융시장 여건 변화 및 일부 신흥시장국의 성장세 약화 등에 영향받을 가능성이 상존하고 있다.
국내경제를 보면, 내수관련 지표의 개선과 부진이 병존하는 가운데 수출이 증가세를 이어가면서 경기가 추세치를 따라 회복세를 지속하였다. 고용 면에서는 취업자수가 50세 이상 연령층과 서비스업을 중심으로 늘어나면서 증가규모가 크게 확대되었다. 앞으로 GDP갭은 당분간 마이너스 상태를 유지하겠으나 그 폭은 점차 축소될 것으로 예상된다.
2월중 소비자물가 상승률은 석유류가격의 하락폭 확대 등으로 전월의 1.1%에서 1.0%로 소폭 낮아졌으나, 농산물 및 석유류 제외 근원인플레이션율은 전월과 같은 1.7%를 나타내었다. 앞으로 물가상승률은 농산물 작황 호조 등으로 당분간 낮은 수준을 나타내겠으나 점차 높아질 것으로 전망된다. 주택시장을 보면, 매매가격은 수도권과 지방에서 모두 소폭 상승하였으며, 전세가격은 수도권과 지방에서 각각 전월과 비슷한 수준의 상승세를 지속하였다.
금융시장에서는 주가가 국제금융시장 안정 등에 힙입어 상승하였다가 중국의 경기둔화 우려 증대 등으로 반락하였으며, 환율은 신흥시장국 금융불안 완화 등으로 하락한 후 소폭 등락하였다. 장기시장금리는 비교적 좁은 범위 내에서 변동하였다.
금융통화위원회는 앞으로 주요국의 통화정책 변화 및 동유럽의 지정학적 리스크 등 해외 위험요인의 전개 상황 및 영향에 깊이 유의하면서, 성장세 회복이 지속되도록 지원하는 가운데 중기적 시계에서 소비자물가 상승률이 물가안정목표 범위 내에서 유지되도록 통화정책을 운용해 나갈 것이다.","['금융통화위원회', '다음', '통화정책', '방향', '결정', '시', '한국은행', '기준금리', '현', '수준', '유지', '하다', '통화정책', '운용', '하다', '하다', '세계', '경제', '보다', '미국', '회복', '세', '지속', '되어다', '유로', '지역', '부진', '완화', '되다', '모습', '이다', '가다', '신흥시장', '국', '일부', '국가', '성장', '세', '다소', '약화', '되다', '움직임', '나타내다', '앞', '세계', '경제', '완만', '회복', '세', '지속', '하다', '것', '전망', '되다', '밉다', '준', '양적완화', '축소', '따르다', '글로벌', '금융시장', '여건', '변화', '및', '일부', '신흥시장', '국', '성장', '세', '약화', '등', '영향', '받다', '가능성', '상존', '있다', '국내', '경제', '보다', '내', '관련', '지표', '개선', '부진', '병', '좋다', '가운데', '수출', '증가', '세', '이다', '경기', '추다', '따르다', '회복', '세', '지속', '하다', '고용', '면', '취업', '자수', '세', '이상', '연령', '층', '서비스업', '중심', '늘어나다', '증가', '규모', '크게', '확대', '되어다', '앞', '개다', '당분간', '마이너스', '상태', '유지', '하다', '그', '폭', '점차', '축소', '되다', '것', '예상', '되다', '소비자', '물가', '상', '승률', '유류', '가격', '하락', '폭', '확대', '등', '전월', '로', '폭', '낮아지다', '농산물', '및', '유류', '제외', '인플레이션율', '전월', '같다', '를', '나타내다', '앞', '물가상승률', '농산물', '작황', '호조', '등', '당분간', '낮다', '수준', '나타내다', '점차', '높아지다', '것', '전망', '되다', '택시', '보다', '매매', '가격', '수도권', '지방', '모두', '폭', '상승', '하다', '가격', '수도권', '지방', '각각', '전월', '비슷하다', '수준', '상승세', '지속', '하다', '금융시장', '주가', '국제', '금융시장', '안정', '등', '힙입어', '상승', '하다', '중국', '경기', '둔화', '우려', '증대', '등', '반락', '하다', '환율', '신흥시장', '국', '금융', '불안', '완화', '등', '하락', '후', '폭', '등락', '하다', '장기시', '금리', '비교', '좁다', '범위', '내', '변동', '하다', '금융통화위원회', '앞', '국', '통화정책', '변화', '및', '동유럽', '지정학적', '리스크', '등', '해외', '위험', '요인', '전개', '상황', '및', '영향', '깊이', '유의', '하다', '성장', '세', '회복', '지속', '되다', '지원', '하다', '가운데', '중', '기적', '시계', '소비자', '물가', '상', '승률', '물가', '안정', '목표', '범위', '내', '유지', '되다', '통화정책', '운용', '하다', '나가다', '것']"
2014-04-10,0.9600641385345016,0.039935861465498435,2.5,0.0,0.125,2.375,이주열,박근혜,2.31951392913192,0.901263952893459,"금융통화위원회는 다음 통화정책방향 결정시까지 한국은행 기준금리를 현 수준(2.50%)에서 유지하여 통화정책을 운용하기로 하였다.
세계경제를 보면, 미국에서는 경기회복세가 지속되었고 유로지역에서는 경기부진이 완화되는 모습을 이어갔으며 신흥시장국에서는 일부 국가의 성장세가 다소 약화되었다. 앞으로 세계경제는 완만한 회복세를 지속할 것으로 전망되나, 미 연준의 통화정책 기조 변화에 따른 글로벌 금융시장 여건 변화 및 신흥시장국의 성장세 약화 등에 영향받을 가능성이 상존하고 있다.
국내경제를 보면, 내수관련 지표가 일시 부진하였으나 수출이 호조를 나타내면서 경기가 추세치를 따라 회복세를 지속하였다. 고용 면에서는 취업자수가 50세 이상 연령층과 서비스업을 중심으로 큰 폭의 증가세를 이어갔다. 앞으로 GDP갭은 당분간 마이너스 상태를 유지하겠으나 그 폭은 점차 축소될 것으로 예상된다.
3월중 소비자물가 상승률은 서비스요금 및 축산물가격의 오름폭 확대 등으로 전월의 1.0%에서 1.3%로 높아졌으며, 농산물 및 석유류 제외 근원인플레이션율도 전월의 1.7%에서 2.1%로 상승하였다. 앞으로 물가상승률은 농산물 작황 호조 등으로 당분간 낮은 수준을 나타내겠으나 점차 높아질 것으로 전망된다. 주택시장을 보면, 이사철의 영향이 가세하여 매매가격과 전세가격이 수도권과 지방에서 모두 오름세가 소폭 확대되었다.
금융시장에서는 주가가 중국 경기둔화 우려 등으로 하락하였다가 미국 경기개선 지속 등으로 상승 전환하였다. 환율은 외국인 증권투자자금 유출입 등의 영향을 받으면서 상승하였다가 상당폭 하락하였다. 장기시장금리는 비교적 좁은 범위 내에서 변동하였다.
금융통화위원회는 앞으로 주요국의 통화정책 변화와 일부 신흥시장국의 성장세 약화 및 동유럽의 지정학적 리스크 등 해외 위험요인의 전개 상황 및 영향에 깊이 유의하면서, 성장세 회복이 지속되도록 지원하는 가운데 중기적 시계에서 소비자물가 상승률이 물가안정목표 범위 내에서 유지되도록 통화정책을 운용해 나갈 것이다.","['금융통화위원회', '다음', '통화정책', '방향', '결정', '시', '한국은행', '기준금리', '현', '수준', '유지', '하다', '통화정책', '운용', '하다', '하다', '세계', '경제', '보다', '미국', '회복', '세', '지속', '되어다', '유로', '지역', '부진', '완화', '되다', '모습', '이다', '가다', '신흥시장', '국', '일부', '국가', '성장', '세', '다소', '약화', '되어다', '앞', '세계', '경제', '완만', '회복', '세', '지속', '하다', '것', '전망', '되다', '밉다', '준', '통화정책', '기조', '변화', '따르다', '글로벌', '금융시장', '여건', '변화', '및', '신흥시장', '국', '성장', '세', '약화', '등', '영향', '받다', '가능성', '상존', '있다', '국내', '경제', '보다', '내', '관련', '지표', '일시', '부진하다', '수출', '호조', '나타내다', '경기', '추다', '따르다', '회복', '세', '지속', '하다', '고용', '면', '취업', '자수', '세', '이상', '연령', '층', '서비스업', '중심', '크다', '폭', '증가', '세', '이다', '가다', '앞', '개다', '당분간', '마이너스', '상태', '유지', '하다', '그', '폭', '점차', '축소', '되다', '것', '예상', '되다', '소비자', '물가', '상', '승률', '서비스', '요금', '및', '축산물', '가격', '오름', '폭', '확대', '등', '전월', '로', '높아지다', '농산물', '및', '유류', '제외', '인플레이션율', '전월', '로', '상승', '하다', '앞', '물가상승률', '농산물', '작황', '호조', '등', '당분간', '낮다', '수준', '나타내다', '점차', '높아지다', '것', '전망', '되다', '택시', '보다', '이사철', '영향', '가세', '하다', '매매', '가격', '가격', '수도권', '지방', '모두', '오르다', '폭', '확대', '되어다', '금융시장', '주가', '중국', '경기', '둔화', '우려', '등', '하락', '하다', '미국', '경기', '개선', '지속', '등', '상승', '전환', '하다', '환율', '외국인', '증권', '투자', '자금', '유출', '입', '등', '영향', '받다', '상승', '하다', '상당', '폭', '하락', '하다', '장기시', '금리', '비교', '좁다', '범위', '내', '변동', '하다', '금융통화위원회', '앞', '국', '통화정책', '변화', '일부', '신흥시장', '국', '성장', '세', '약화', '및', '동유럽', '지정학적', '리스크', '등', '해외', '위험', '요인', '전개', '상황', '및', '영향', '깊이', '유의', '하다', '성장', '세', '회복', '지속', '되다', '지원', '하다', '가운데', '중', '기적', '시계', '소비자', '물가', '상', '승률', '물가', '안정', '목표', '범위', '내', '유지', '되다', '통화정책', '운용', '하다', '나가다', '것']"
2014-05-09,0.9610902088069364,0.03890979119306359,2.5,0.0,0.125,2.375,이주열,박근혜,2.31951392913192,0.901263952893459,"금융통화위원회는 다음 통화정책방향 결정시까지 한국은행 기준금리를 현 수준(2.50%)에서 유지하여 통화정책을 운용하기로 하였다.
세계경제를 보면, 미국에서는 경기회복세가 지속되었고 유로지역에서는 경기부진이 완화되는 모습을 이어갔으며 신흥시장국에서는 일부 국가의 성장세가 다소 약화되었다. 앞으로 세계경제는 선진국을 중심으로 완만한 회복세를 지속할 것으로 전망되나, 미 연준의 통화정책 기조 변화에 따른 글로벌 금융시장 여건 변화, 일부 신흥시장국의 성장세 약화 및 동유럽 지정학적 리스크 등에 영향받을 가능성이 상존하고 있다.
국내경제를 보면, 수출이 호조를 이어가면서 경기가 추세치를 따라 회복세를 지속하였다. 고용 면에서는 취업자수가 50세 이상 연령층과 서비스업을 중심으로 큰 폭의 증가세를 이어갔다. 앞으로 GDP갭은 당분간 마이너스 상태를 유지하겠으나 그 폭은 점차 축소될 것으로 예상된다.
4월중 소비자물가 상승률은 공업제품가격 및 서비스요금의 오름폭 확대 등으로 전월의 1.3%에서 1.5%로 높아졌으며, 농산물 및 석유류 제외 근원인플레이션율도 전월의 2.1%에서 2.3%로 상승하였다. 앞으로 물가상승률은 농산물가격 안정 등으로 당분간 낮은 수준을 나타내겠으나 점차 높아질 것으로 전망된다. 주택매매가격과 전세가격은 수도권과 지방에서 모두 오름세가 둔화되었다.
금융시장에서는 주가가 외국인 주식순매수 등에 힘입어 상승하다가 동유럽 지정학적 리스크 등의 영향을 받아 상당폭 하락하였다. 환율은 경상수지 흑자 지속과 외국인 증권투자자금 유입 등으로 큰 폭 하락하였다. 장기시장금리는 좁은 범위 내에서 변동하였다.
금융통화위원회는 앞으로 주요국의 통화정책 변화 등 해외 위험요인에 유의하고 세월호 사고 이후의 내수 움직임을 면밀히 점검하면서, 성장세 회복이 지속되도록 지원하는 가운데 중기적 시계에서 소비자물가 상승률이 물가안정목표 범위 내에서 유지되도록 통화정책을 운용해 나갈 것이다.","['금융통화위원회', '다음', '통화정책', '방향', '결정', '시', '한국은행', '기준금리', '현', '수준', '유지', '하다', '통화정책', '운용', '하다', '하다', '세계', '경제', '보다', '미국', '회복', '세', '지속', '되어다', '유로', '지역', '부진', '완화', '되다', '모습', '이다', '가다', '신흥시장', '국', '일부', '국가', '성장', '세', '다소', '약화', '되어다', '앞', '세계', '경제', '선진국', '중심', '완만', '회복', '세', '지속', '하다', '것', '전망', '되다', '밉다', '준', '통화정책', '기조', '변화', '따르다', '글로벌', '금융시장', '여건', '변화', '일부', '신흥시장', '국', '성장', '세', '약화', '및', '동유럽', '지정학적', '리스크', '등', '영향', '받다', '가능성', '상존', '있다', '국내', '경제', '보다', '수출', '호조', '이다', '경기', '추다', '따르다', '회복', '세', '지속', '하다', '고용', '면', '취업', '자수', '세', '이상', '연령', '층', '서비스업', '중심', '크다', '폭', '증가', '세', '이다', '가다', '앞', '개다', '당분간', '마이너스', '상태', '유지', '하다', '그', '폭', '점차', '축소', '되다', '것', '예상', '되다', '소비자', '물가', '상', '승률', '공업', '제품', '가격', '및', '서비스', '요금', '오름', '폭', '확대', '등', '전월', '로', '높아지다', '농산물', '및', '유류', '제외', '인플레이션율', '전월', '로', '상승', '하다', '앞', '물가상승률', '농산물', '가격', '안정', '등', '당분간', '낮다', '수준', '나타내다', '점차', '높아지다', '것', '전망', '되다', '주택', '매매', '가격', '가격', '수도권', '지방', '모두', '오르다', '둔화', '되어다', '금융시장', '주가', '외국인', '주식', '매수', '등', '힘', '입다', '상승', '하다', '동유럽', '지정학적', '리스크', '등', '영향', '받다', '상당', '폭', '하락', '하다', '환율', '경상수지', '흑자', '지속', '외국인', '증권', '투자', '자금', '유입', '등', '크다', '폭', '하락', '하다', '장기시', '금리', '좁다', '범위', '내', '변동', '하다', '금융통화위원회', '앞', '국', '통화정책', '변화', '등', '해외', '위험', '요인', '유의', '세월호', '사고', '이후', '내', '수', '움직임', '면밀하다', '점검', '하다', '성장', '세', '회복', '지속', '되다', '지원', '하다', '가운데', '중', '기적', '시계', '소비자', '물가', '상', '승률', '물가', '안정', '목표', '범위', '내', '유지', '되다', '통화정책', '운용', '하다', '나가다', '것']"
2014-06-12,0.947953632538968,0.05204636746103197,2.5,0.0,0.125,2.375,이주열,박근혜,2.31951392913192,0.901263952893459,"금융통화위원회는 다음 통화정책방향 결정시까지 한국은행 기준금리를 현 수준(2.50%)에서 유지하여 통화정책을 운용하기로 하였다.
세계경제를 보면, 미국에서는 경기회복세가 지속되었고 유로지역에서는 경기부진이 완화되는 모습을 이어갔으며 신흥시장국에서는 일부 국가의 성장세가 다소 약화되었다. 앞으로 세계경제는 선진국을 중심으로 완만한 회복세를 지속할 것으로 전망되나, 미 연준의 통화정책 기조 변화에 따른 글로벌 금융시장 여건 변화, 일부 신흥시장국의 성장세 약화 등에 영향받을 가능성이 상존하고 있다.
국내경제를 보면, 수출이 호조를 보였으나 세월호 사고의 영향 등으로 소비가 다소 위축되면서 회복세가 주춤하는 모습을 나타내었다. 고용 면에서는 취업자수가 50세 이상 연령층과 서비스업을 중심으로 예년 수준의 증가세를 나타내었다. 앞으로 GDP갭은 당분간 마이너스 상태를 유지하겠으나 그 폭은 점차 축소될 것으로 예상된다.
5월중 소비자물가 상승률은 농산물 및 석유류 가격의 하락폭 축소 등으로 전월의 1.5%에서 1.7%로 높아졌으며, 농산물 및 석유류 제외 근원인플레이션율은 전월의 2.3%에서 2.2%로 소폭 하락하였다. 앞으로 물가상승률은 당분간 낮은 수준을 나타내겠으나 점차 높아질 것으로 전망된다. 주택매매가격과 전세가격은 수도권과 지방에서 모두 오름세가 둔화되었다.
금융시장에서는 주요국의 완화적 통화정책 지속 기대, 외국인의 증권투자자금 유입 등의 영향으로 주가가 상승하였으며 장기시장금리와 환율은 하락하였다.
금융통화위원회는 앞으로 주요국의 통화정책 변화 등 해외 위험요인에 유의하고 세월호 사고 이후의 내수 움직임을 면밀히 점검하면서, 성장세 회복이 지속되도록 지원하는 가운데 중기적 시계에서 소비자물가 상승률이 물가안정목표 범위 내에서 유지되도록 통화정책을 운용해 나갈 것이다.","['금융통화위원회', '다음', '통화정책', '방향', '결정', '시', '한국은행', '기준금리', '현', '수준', '유지', '하다', '통화정책', '운용', '하다', '하다', '세계', '경제', '보다', '미국', '회복', '세', '지속', '되어다', '유로', '지역', '부진', '완화', '되다', '모습', '이다', '가다', '신흥시장', '국', '일부', '국가', '성장', '세', '다소', '약화', '되어다', '앞', '세계', '경제', '선진국', '중심', '완만', '회복', '세', '지속', '하다', '것', '전망', '되다', '밉다', '준', '통화정책', '기조', '변화', '따르다', '글로벌', '금융시장', '여건', '변화', '일부', '신흥시장', '국', '성장', '세', '약화', '등', '영향', '받다', '가능성', '상존', '있다', '국내', '경제', '보다', '수출', '호조', '보이다', '세월호', '사고', '영향', '등', '소비', '다소', '위축', '되다', '회복', '세', '주춤', '하다', '모습', '나타내다', '고용', '면', '취업', '자수', '세', '이상', '연령', '층', '서비스업', '중심', '예년', '수준', '증가', '세', '나타내다', '앞', '개다', '당분간', '마이너스', '상태', '유지', '하다', '그', '폭', '점차', '축소', '되다', '것', '예상', '되다', '소비자', '물가', '상', '승률', '농산물', '및', '유류', '가격', '하락', '폭', '축소', '등', '전월', '로', '높아지다', '농산물', '및', '유류', '제외', '인플레이션율', '전월', '로', '폭', '하락', '하다', '앞', '물가상승률', '당분간', '낮다', '수준', '나타내다', '점차', '높아지다', '것', '전망', '되다', '주택', '매매', '가격', '가격', '수도권', '지방', '모두', '오르다', '둔화', '되어다', '금융시장', '국', '완화', '통화정책', '지속', '기대', '외국인', '증권', '투자', '자금', '유입', '등', '영향', '주가', '상승', '하다', '장기시', '금리', '환율', '하락', '하다', '금융통화위원회', '앞', '국', '통화정책', '변화', '등', '해외', '위험', '요인', '유의', '세월호', '사고', '이후', '내', '수', '움직임', '면밀하다', '점검', '하다', '성장', '세', '회복', '지속', '되다', '지원', '하다', '가운데', '중', '기적', '시계', '소비자', '물가', '상', '승률', '물가', '안정', '목표', '범위', '내', '유지', '되다', '통화정책', '운용', '하다', '나가다', '것']"
